{
  "$schema": "https://json-schema.org/draft/2020-12/schema",
  "$id": "https://comfy.dev/schemas/quest-receipt-v1.json",
  "title": "QuestReceiptV1",
  "type": "object",
  "required": [
    "schema_version",
    "request_id",
    "source_revision",
    "compiled_quest_revision",
    "active_runtime_revision",
    "status",
    "installed_at",
    "runtime_signature"
  ],
  "properties": {
    "schema_version": {
      "type": "string",
      "const": "QuestReceipt/v1"
    },
    "request_id": {
      "type": "string",
      "pattern": "^[a-zA-Z0-9_-]+$"
    },
    "source_revision": {
      "type": "string",
      "pattern": "^(sha256:[a-f0-9]{64}|[a-f0-9]{40,64})$"
    },
    "compiled_quest_revision": {
      "type": "string",
      "pattern": "^sha256:[a-f0-9]{64}$"
    },
    "active_runtime_revision": {
      "type": "string",
      "pattern": "^sha256:[a-f0-9]{64}$"
    },
    "status": {
      "type": "string",
      "enum": [
        "admitted",
        "rejected",
        "rolled_back"
      ]
    },
    "installed_at": {
      "type": "string"
    },
    "runtime_signature": {
      "type": "string"
    }
  },
  "additionalProperties": false
}
