{
  "schema_version": "QuestReceipt/v1",
  "request_id": "req_9856c46b6156436d",
  "source_revision": "aaaaaaaaaaaaaaaaaaaaaaaaaaaaaaaaaaaaaaaa",
  "compiled_quest_revision": "sha256:8d3673453dd65be7f529b3642350d27cf71c5dc376d55976903d313ed74c030e",
  "active_runtime_revision": "sha256:8d3673453dd65be7f529b3642350d27cf71c5dc376d55976903d313ed74c030e",
  "status": "admitted",
  "installed_at": "2026-08-30T06:32:15.197822+00:00",
  "runtime_signature": "MGNhY2RlM2UzMDVhNTRmN2Y1NWMxZTczOGNmMjczOTg1YTc5ZDdjZDYzYWMzMzRiODZmMmEzYzk1ODI2NTM4Yw=="
}